Address;Text;Stars;DateКараванная, 1 лит А;Хороший магазин. Уважают тут покупателей. Готовы решить любые вопросы. Здороваются. Вежливо общаются. Богатый ассортимент различной продукции. Есть свое собственное кулинарное производство. Все удобно расположено. Нет узких проходов. Везде чистота и порядок. Нет духоты. Качество товаров приличное. Много заманчивых временных акций. Интересная программа лояльности. Средний уровень цен. Что-то можно купить по низким ценам.;4;22 марта 2023Караванная, 1 лит А;На удивление, много свежих продуктов. Даже готовые всякие обеды.Маленький, в меру тесный магазин.С игристым вином беда: какие-то напитки и прочие санты стефаны. Отрыл брют французский... Ну и ладно.Основное, что удивило - бабушка кассир. Понимаю, что в Питере не принято упаковывать покупку клиента в пакет, но не здороваться, кидать пакет и накладывать сверху на него товары, что ты и пакет вытащить не можешь - странно.Бабушка очень вежливо общалась со своей знакомой, потом проигнорировала покупателя передо мной (он то, что-то попросил подать из-за кассы, то просто поздоровался - кассир не слышит ничего, тк беседа с подругой важнее).Полное ощущение что здесь должен покупатель, как минимум обязан кланяться сотрудникам.;3;16 марта 2023Караванная, 1 лит А;Вкусные полуфабрикаты и выпечка;4;26 февраля 2023Караванная, 1 лит А;"Магазин в целом неплохой, есть многое. Но в самом магазине какие-то ""закаулки"". Хлебный отдел долго искала";3;1 февраля 2023, отредактированКараванная, 1 лит А;Приятный ассортимент;5;29 октября 2022Караванная, 1 лит А;Хорошие акции, но которых можно купить качественные продукты, а не неликвид с истекшими сроками.;4;24 сентября 2022Караванная, 1 лит А;Пишу отзыв с благодарностью.Нас очень выручило удачное расположение магазина в центре города. Можно было по обычной цене (а то и по скидкам) в жару купить мороженное и воду, в то время как в парках и на улицах неподалеку на эти товары цены просто запредельные!;5;28 августа 2022Караванная, 1 лит А;Частые акции, можно очень выгодно закупиться;5;21 августа 2022Караванная, 1 лит А;Очень удобное расположение в историческом центре Питера.;5;15 августа 2022Караванная, 1 лит А;На прилавках чаще бардак, чем порядок, ценники не все, очень неприятные кассиры.;2;23 июля 2022Караванная, 1 лит А;Обожаю пятерочку, особенно горячую молодую кассиршу;5;19 июля 2022Караванная, 1 лит А;Опять несостыковки в чеке, ценники нарочно не меняют чтобы люди покупали товары якобы по скидке;1;17 июля 2022Караванная, 1 лит А;обычная Пятёрочка. Есть кассы самообслуживания - это плюс;4;9 июля 2022Караванная, 1 лит А;Вообще ни разу не выручает, скорее наоборот - постоянно подводят своими мутными схема с ценниками;1;22 июня 2022Караванная, 1 лит А;"Очень грустно наблюдать,как у взрослой женщины выросло чрезвычайное самомнение,но не успел вырасти интеллект и элементарные нормы общения.Хожу в этот магазин 2 года,знаю практически всех продавцов,всегда общаются приветливо и без пренебрежения.Зашла взять стики,показала продавцу на кассе самообслуживания какие мне нужны (достала из кармана свою пачку).Приносит мне другие со словами ""В смысле?Вы же сказали эти"" хотя ПОКАЗАЛА я ей вообще другую пачку.На данных кассах нужно подтверждение продавца,что покупатель совершеннолетний,я зову вновь эту мадам с просьбой провести,на что слышу ""А чем вы мне докажите?"" в настолько хамской и наглой интонации,что очень хотелось ей доказать лишь то,что вся эта пачка запросто может оказаться в ее ""зоне самообслуживания""Такую дичь я встретила тут впервые,желания посещать магазин более нет,благо альтернативный вариант в виде Спара с нормальными продавцами в шаговой доступности";1;25 апреля 2022, отредактированКараванная, 1 лит А;Понравилось все ,кроме того,что тесно в помешении;4;31 марта 2022Караванная, 1 лит А;Не сталкивался с проблемами в этом магазине, обычно всё хорошо. Есть нужные продукты, есть всегда скидки, продавцы попадаются обычные, ничего плохого не скажешь;4;21 февраля 2022Караванная, 1 лит А;Хороший магазин. Большой выбор продукции на любой вкус. Очередей почти не бывает . Есть без контактные терминал для оплаты безналом. Всегда скидки на продукцию повышенного спроса. За наличием просрочки регулярно следят. Большой стеллаж алкогольной продукции.;3;5 ноября 2021Караванная, 1 лит А;Ужасный магазин. Нету интернета, не пробилась карта 5.;1;26 июня 2021Караванная, 1 лит А;Нет ценников на большое количество товаров. Неудобное расположение холодильников и стеллажей с напитками, разбросаны по всему магазину.;1;21 июня 2021Караванная, 1 лит А;Магазин в целом приемлимые, но из-за отсутствия моих любимых презерватитов VIZIT приходится бегать в аптеку, а удобней было бы купить прям там, со всеми продуктами;4;19 мая 2021Караванная, 1 лит А;Постоянно обсчитывают, приходится доказывать на кассе, что ценник в зале другой, а смотрят так как-будто я у них в долг взяла!!! Пора им сворачиваться, Спар и то лучше был!!;1;6 мая 2021, отредактированКараванная, 1 лит А;Добавьте bcaa и смолу шу пуэра пожалуйста. Нет ключей от шкафчиков. Не поняла как и где взвесить овощи ? На кассе ? Бренди вкусное. Нет сушеного мяса и ботищалов. Алсо нет кофе нормального, например Бушидо. Нет тампонов. Нет бумаги для уборной с сиренью. Нет минеральной воды Сан ПелегриноUPD выбор вина отличный, очень вкусное. Минералка появилась и кофе тоже, мини-тампоны нет, обычные да.;5;30 апреля 2021, отредактированКараванная, 1 лит А;"20 декабря посетил этот ритейл. Все началось с того , что на мой вопрос сотруднику (форменная одежда, бейдж) ""где у Вас находится отдел с водой"" мне ответили : "" я не работаю"" и продолжил диалог с другим сотрудником магазина. В итоге искал воду минут 10 нашел :)Затем уже на кассе , во время того как меня обслуживали , кассир встал со своего рабочего места по личным вопросам и вернулся спустя какое то время. А я стоял и ждал в надежде, когда меня ,,дообслуживают,,В обще и целом такой сервис не первый раз. Примите меры.";1;20 декабря 2020Караванная, 1 лит А;ужасная сеть,вечный бардак как с продуктами на полках,так и с ценниками;3;15 октября 2020Караванная, 1 лит А;В этом магазине работают очень приятные и вежливые сотрудники, это прям редкость, особенно для Пятерочки));5;3 июля 2020Караванная, 1 лит А;Хороший магазин, удобно расположен, все что нужно есть, но к сожалениею работает не круглосуточно.;4;9 марта 2020Караванная, 1 лит А;В информации написано, что магазин работает до 23.30, пришла в 23.03, магазин уже закрыт :(((;1;11 октября 2019Караванная, 1 лит А;Пятерочка эта уже не работает круглосуточно!;2;19 октября 2018Караванная, 1 лит А;Отличный магазин по ценам и расположению в отличие от своих конкурентов, находящихся в центре города. Кроме того, радует большой товарный зал с хорошим оформлением и свежим ремонтом.;5;25 апреля 2018Караванная, 1 лит А;Я захожу сюда не очень часто, но когда захожу - здесь стабильно плохо. Сегодня в 12 дня в будний день я стояла в очереди из человек 8-10, чтобы купить себе мороженое. Выбор молочных продуктов не очень, например, полки с творожными сырками почти пустые, йогуртов и творожных масс тоже немного.Здесь большой выбор алкоголя, в основном дешёвых сортов пива и вина.Кассиры не улыбаются, но это нормально, у нас не принято улыбаться в такого уровня супермаркетах.;2;22 сентября 2017Караванная, 1 лит А;Неожиданное место для магазина. Никогда не думал, что на Кленовой аллее и Манежной площади откроется магазин. Народу не много. Очередей нет. продукты в целом качественные. Обслуживание средненькое. А тыква, что на фото просто великолепная!;4;3 марта 2016Литейный проспект, 43;Нормальный;1;24 августа 2023Литейный проспект, 43;Попросили документы, на кассе ничего кроме энергетика не было. Мне 28 лет, можете, пожалуйста, подбирать зрячих кассиров, а не бомжей с помойки. Отвратительно.;5;19 июля 2023Литейный проспект, 43;Хороший коллектив и директор.;4;9 мая 2023, отредактированЛитейный проспект, 43;Низкие цены и хорошее качество;5;19 ноября 2022Литейный проспект, 43;Центр. И отличный магазин.;4;10 ноября 2022, отредактированЛитейный проспект, 43;"Классический продуктовый семейства ""Пятёрочка"", средний набор продуктов, средние цены, ну и работа персонала, тоже довольно средняя";1;13 августа 2022, отредактированЛитейный проспект, 43;Магазин весь грязный, раздолбанный, работает одно хамло;5;12 марта 2022Литейный проспект, 43;Наталья Нечупорак(фамилия возможно не так написана) очень милая и приятная кассир.;4;19 мая 2021Литейный проспект, 43;Очень хороший магазин. Поставил бы пять звезд, если бы продавали мой любимый VIZIT.;3;4 мая 2021Литейный проспект, 43;Ценники не везде, где то неправильно стоят. Ну и персонал не особа расположен к покупателю);1;14 февраля 2021Литейный проспект, 43;Не продали товар, потому что плохая связь с банком и оплата не проходит. Вообще ничего не сделали. Бесит. Как будто не Питер 2020 а сельпо 2003.;4;6 июля 2020Литейный проспект, 43;Нормальный, хороший, достаточно чистый супермаркет. Удобно, не далеко от дома, самое основное всегда есть;2;18 сентября 2019Литейный проспект, 43;Поход в этот магазин превращается в игру «угадай реальную цену». Вижу йогурт, на ценнике 29.90, это даже не акция. На кассе оказывается, что стоит он 40. Вижу шоколад по акции. Ценник гласит что-то в районе 55 рублей, Касса отбивает 60 с копейками.И вроде несовпадение всего в 5-10₽, но если учесть, что я иду в магазин с определённой суммой и пытаюсь уложиться в неё, У МЕНЯ НИ РАЗУ НЕ ПОЛУЧИЛОСЬ ЭТО СДЕЛАТЬ. Товаров беру штуки по три каждого- несоответствие выливается в разницу в среднем от 50₽. Надоели.Две звезды: за круглосуточную работу и за то, что из ближайших магазинов тут самый широкий ассортимент.;3;28 марта 2019Литейный проспект, 43;Магазин новый, поэтому чистый и аккуратный. Ассортимент вполне удовлетворяет самые разнообразные потребности в еде. Продукты в целом качественные. По акциям вполне неплохо можно экономить. В зимне-весенний период выбор овощей не очень хороший, да и качество не очень то, а цена высокая. Персонал в целом вежлив. Но вот сегодня попал на всего одну работающую кассу. Я был 8 в очереди, за мной ещё 4 человека стояло. Ни одну дополнительную кассу естественно не открыли. Народ не возмущался. Я тоже молчал так как вообще ни на какие возмущения сил в конце рабочего дня небыло.;0;11 апреля 2016, отредактированДостоевского, 30/23;Отличный магаз, всё нравится.;5;5 июля 2023Достоевского, 30/23;Купила в этом магазине лимон, принесла домой, разрезали, а он гнилой. Очень много просроченной продукции, особенно овощей. Не рекомендую.;1;1 июля 2023Достоевского, 30/23;Хороший магазн приветливый персонал, цены топ)));4;31 мая 2023Достоевского, 30/23;Булки, кофе, самообслуживание - уже хорошо.;4;23 августа 2022, отредактированДостоевского, 30/23;2 этажа пятерочки;5;30 марта 2022Достоевского, 30/23;На ценниках цены одни, на кассе пробивают другие (без скидки, выше) когда заметишь уже потом, говорят надо было сразу смотреть… а как уследишь в потоке очереди, когда они скандируют со скоростью пулемета? 🤷🏻 обман и хамство (((;1;23 октября 2021Достоевского, 30/23;Сделали ремонт, стало уютно. Появилась выпечка, недорогая и достаточно вкусная. На остальное цены, конечно, жесть, накрутка практически до ста процентов доходит.;3;12 октября 2021Достоевского, 30/23;Все хорошо, не мог понять где чай, консультанты все подсказали. Впринципе приветливые, скидки на самые нужные товары есть. Не выгнали меня с собакой;5;19 сентября 2021Достоевского, 30/23;Кассир Курги Елена Владимировна (23.08.21 _ 16-50) - хамила, швыряла продукты в мою сторону(а это были овощи) и карту скидочную, в общем вела себя так, словно сегодня последний день работала. При этом я был в маске и поздоровался с женщиной, но видимо, высокий сервис обслуживания - это не про Питерские магазины.;1;23 августа 2021Достоевского, 30/23;Ужасный магазин, просрочку встречаем регулярно, всегда приходится читать срок годности. С ценниками всегда непорядок - постоянно надо перепроверять, персонал регулярно старается подсунуть товары якобы по акции;1;8 августа 2021Достоевского, 30/23;Воды нет! +33 на улице! Сетевой супермаркет, а воды нет, ни какой, ни с газом, ни без газа, нет ни литра. Одни сахарные лимонады и прочая гадость.;2;15 июля 2021Достоевского, 30/23;Ужасный магазин, продавец нагрубила, не советую, хотя, думаю, все магазины этой сети не клиентоориентированные;1;4 июля 2021Достоевского, 30/23;Второй этаж они себе позволить могут, а холодос для воды нет. Ну и нафиг такой магазин нужен?;1;1 июля 2021Достоевского, 30/23;Второй этаж конечно хорошо, но если ты с ребёнком в коляске - это огромный минус. А так, хороший магазин, жаль что не круглосуточный как на Владимирской);4;29 сентября 2019Достоевского, 30/23;Сняли номер и 5рочка находится за углом. Супер удобно и практично, работает до 23:00, что часто спасало.Закупились тут и мылом, и продуктами, и соками/водичкой, печеньками и тд Все здесь есть по первым и второстепенным нуждам.5рочка эта двухэтажная, не сразу поняли, тк скромная табличка показывает наверх и думаешь, что это пристрой чего то другого, а не 5рочки.;5;14 мая 2019Загородный проспект, 35;У вас продавцы не знают чем заняться в 19:50 ? Одна не знает что покушать, другая вино покупает. Может лучше все вместе займутся ценниками! Где цена на товар? И вообще в большинстве организаций сотрудникам запрещают совершать покупки в рабочее время.+Через 2 дня зашёл и ничего не изменилось.;1;6 июля 2023, отредактированЗагородный проспект, 35;Грязно, отвратительные продукты. Короче, ужас.;1;26 апреля 2023Загородный проспект, 35;12.01.23.Классненько.Моя ошибка конечно, что не посмотрела, но, да;4;12 января 2023Загородный проспект, 35;Цены в Пятерочке - топ!;5;6 ноября 2022Загородный проспект, 35;Отлично все;5;15 октября 2022Загородный проспект, 35;Все Гуд, быстро и вежливо;1;20 августа 2022Загородный проспект, 35;Это просто ужас ,даже не описать словами;1;22 июля 2022Загородный проспект, 35;Ужасное обслуживание кассиров, занимаются своими делами (13.05 девушка вызывала такси кому-то из своих друзей, хотя должна работать!);5;13 мая 2022Загородный проспект, 35;Цены и продукция кеш;1;30 октября 2021Загородный проспект, 35;Ужасное место, особенно, что касается доставки;5;19 октября 2021Загородный проспект, 35;Больших очередей здесь никогда нет. Из Пятёрочки теперь можно забирать заказы с Озона. Недалеко от Витебского вокзала, можно по пути с дачи купить продукты.;3;23 апреля 2021Загородный проспект, 35;Вроде нормальный магазин, но на полках иногда лежит просрочка, будьте внимательны :(;1;15 октября 2020, отредактирован