Address;Text;Stars;DateКирочная, 24;Обычно у Пятёрочки огромные вывески, а тут прям не заметно что есть магазин этой сети. Пятёрочка находится на месте Полушки (была такая сеть), в очень красивом доме. Но сам магазин ещё в старом формате, а это весьма и весьма убого. Вокруг полно кафе и магазинов с готовой едой, а тут ассортимент такой же как и везде, без поправки на работников офисов и тысячи студентов.Есть очереди, но есть и кассы самообслуживания.;1;16 февраля 2022Кирочная, 24;Самый ущербный магазин в округе в плане сервиса. Продавцы грубят, менеджеры грубят - конечно, понимаю, жизнь не сахар, но делать из себя таких «обиженных» с таким отношением к покупателям … Черт его знает, лучше купить что-то в других магазинах по соседству, а этот стороной обойти.;1;14 сентября 2021Кирочная, 24;"Кассир в магазине начала хамить не из-за чего. Кашляла на весь магазин и обслуживала покупателей без маски. Кассир, которая сидит на кассе с ""сигаретами"". Ужас тихий";1;25 июля 2021Кирочная, 24;Стрёмный магазин, ценники не соответствуют, кассиры как из 90х. Ощущение что магазин заброшен, когда там менялся ассортимент- непонятно.;3;5 апреля 2021Кирочная, 24;"В магазине всегда довольно чисто, никогда не попадалась просрочка.Из минусов можно отметить отсутствие выбора в отделе бытовой химии, а также несколько ""специфическое"" отношение кассиров к покупателям (очень специфическое).";1;16 октября 2020Кирочная, 24;Решетова Светлана Владимировна - директор данного магазина, хамское поведение, требует носить с собой паспорт - фото ей не достаточно, чтобы продать взрослому человеку пачку сигарет. Так не ведут себя руководители, в сервисе, говорить слово - нет - не приемлемо для директора тем более! Моё мнение, что данный сотрудник не справляется с должностью руководителя, примите меры выше стоящее руководство! Спасибо.;3;13 июля 2020, отредактированКирочная, 24;Продают гнилую тыкву в вакууме по 69 р. Уже два раза. Относятся к покупателям как к совсем не среднему классу.;1;20 марта 2020Кирочная, 24;"Сплошное хамство и обман. На ценниках цифры одни, а в чеке другие. Цитирую ответ главного: ""там же написано: 1+1, акция! Андэстэнд?"".0 из 10 этой пятёрочке.";5;18 февраля 2020, отредактированКирочная, 24;Чисто - нет разводов на полу.Низкие цены - лимоны по 109 за кг.Вежливые кассиры - с пониманием отнеслись к просьбе не заворачивать муку в пакетик.;5;23 января 2020Кирочная, 24;По открытию были постоянно проблемы с не правильными ценниками. Но сейчас хороший магазин;1;29 декабря 2019Кирочная, 24;Кассиры хамки никакого человеческого отношения !!;1;22 декабря 2019Кирочная, 24;не работала лента на кассе, и кассирша вместо того, чтобы попросить нормально, начала командным голосом говорить чтобы мы подали ей продукты, край неуважения к покупателям;2;12 декабря 2019Кирочная, 24;Кассир игнорирует банальный вопрос, продавцы всем видом показывают, что хотят чтобы к ним вообще не заходили.;5;19 ноября 2019Кирочная, 24;Чисто, все свежее, персонал приветливый.;0;10 ноября 2019Транспортный переулок, 1;Неадекватный директор;1;23 апреля 2023, отредактированТранспортный переулок, 1;Крайне не советую этот магазин. Детектор хам и от него розит алкоголем;1;3 февраля 2023Транспортный переулок, 1;Чистый магазин, вежливые кассиры, хорошая выпечка (после 10 утра).;5;5 января 2023Транспортный переулок, 1;Чисто,кассиры вежливые, ценники как везде в пятерочке -бывают путаные,Но на кассе всё посчитали в пользу покупателя;5;24 декабря 2022Транспортный переулок, 1;На мою просьбу следить за ценниками, так как три раза подходила на кассу меняла товар, потому что не соответствует ничего, мне сказали АГА ОБЯЗАТЕЛЬНО. Это было на кассе где сигареты в 17:46 где то, проведите бесседу со своими хамками;1;1 ноября 2022Транспортный переулок, 1;Хороший магазин рядом с домом, просторный, очередей нет, самое необходимое есть, свежая выпечка очень нравится.;5;1 сентября 2022, отредактированПлощадь Ленина, 8;Понимаю, «время работы 7-24»;1;2 сентября 2023Площадь Ленина, 8;"Кассы самообслуживания в достаточном количестве, не приходится стоять в очереди в час пик. Ассортимент вовремя ""освежают"".";5;25 августа 2023, отредактированПлощадь Ленина, 8;Не уютно, тесно, грязно.;1;17 июня 2023, отредактированПлощадь Ленина, 8;Располагается рядом с домом, вежливый персонал, хорошие цены.;5;12 июня 2023Площадь Ленина, 8;Зашел за едой и ужаснулся кассирша сидит за кассой без маски и кашляет на покупателей. Они замечания делают а тетеньке похрену сидит и кашляет! Магазин был битком набит людьми и очередь на кассу огромная! Безобразие отправьте пожалуйста кассиршу к врачу пусть лечится и не заражает покупателей вирусами!!!;1;15 декабря 2022Площадь Ленина, 8;Стандартная Пятерка, но постоянные очереди очень раздражают…;3;6 сентября 2022Площадь Ленина, 8;Всё. От ассортимента до обслуживания;5;16 августа 2022, отредактированПлощадь Ленина, 8;Зашел перед поездкой на дачу, купил все сто нужно было. Очереди не было, свежая молочка и сыр, хлеб и крупа. На вопрос а где же алкоголь ответили и показали сразу. Обслуживание хорошее. Есть холодное мороженное и его много. Спасибо затарился как надо, на недельку.;5;5 июля 2022Площадь Ленина, 8;Обычный магазин;3;28 июня 2022Площадь Ленина, 8;Все есть, в ассортименте еда питье и вкусности, купили самое необходимое для электропутешествия в Солнечное на пляж. удивительно, что очередей нет, как везде! В зале чисто просторно и недорого! Спасибо.;5;31 мая 2022Площадь Ленина, 8;Цены не соответствуют ценнику, скидки не действительныПерсонал так и нравится заглянуть в корзинуПри оплате, обычными словами лезут под руку...;1;17 мая 2022Площадь Ленина, 8;Не понравилось. Меня не пустили в магазин. Я весь день мечтал о конфете киткат в темном шоколаде и ради этой конфеты приехал из другого города, но меня не пустили в магазин в 23:46, хотя пятёрочка ещё должна была работать 15 минут, согласно информации, указанной в 2гисБан, дизлайк, отпискаприходите за киткатом заранее;1;30 апреля 2022Площадь Ленина, 8;Ужасно грубый персонал не умеющий работать в спорных вопросах, на КСО постоянно нет одноразовых пакетов (хотя раньше они там всегда были), постоянно мусор или кккие-нибудь коробки на проходе очень мало места в магазине, особенно, если перед обычной кассой скопиться очередь. Неоправданно большие цены и отсутствует пекарня. Ходил в этот магазин, только потому, что он рядом с домом, но даже этот плюс не перекрывает вышеозвученные недостатки. Одним словом не магазин, а мрак полный!;1;16 марта 2022Площадь Ленина, 8;Очереди на 10 человек;1;17 июля 2021Площадь Ленина, 8;Подозревают даже не смотря;1;4 июля 2021Площадь Ленина, 8;"Боюсь, что отзывы ниже ""накрутка"" персонала, так как магазин:а) грязноват, на полу пустые коробки из-под распакованных товаровб) старый ремонт, очень мало место между полками и стеллажами, с тележкой покупателям явно не разойтись в проходев) 08.03 2021 ~16:30-40 был полный магазин людей, очереди в каждую из касс, из самообслуживания работает 1 из 3-х и на просьбу что-либо сделать: охранник передаёт со смехом карточку разблокировки сотруднику зала *я не умею"", последний же открывает вторую кассу и трогает остальные, на нерешительные просьбы людей открыть оставшиеся ""это не нужно, нет времени, стойте в обычные"".Уважаемые X5, это явно не тот стандарт, который Вы позиционируете для своего бренда. Возможно не обратите внимание, но никому не советую магазин, надеюсь, что ситуация изменится со временем (в фотографиях магазина прилагаю хаос у касс воочию).";2;8 марта 2021Площадь Ленина, 8;Хороший магазин и директор;5;20 ноября 2020Площадь Ленина, 8;Хороший магазин, вежливый персонал. Самый лучший магазин во всем Санкт Петербурге!!!!;5;20 ноября 2020Площадь Ленина, 8;Вежливый персонал, большой выбор товара.;5;20 ноября 2020Площадь Ленина, 8;Хороший ,чистый магазин с хорошими сотрудниками и хорошим ассортиментом;5;20 ноября 2020Площадь Ленина, 8;Хороший магазин ,ценники всегда корректные ,вежливый персонал;5;20 ноября 2020Площадь Ленина, 8;В этом магазине большой ассортимент товаров, в отличии от других пятерочек;5;18 ноября 2020Площадь Ленина, 8;Хороший магазин, отличные сотрудники;5;13 ноября 2020Площадь Ленина, 8;Хороший коллектив, терпеливый администратор, пытается помочь покупателям. Быстро нашла нужный товар.;5;2 ноября 2020Площадь Ленина, 8;Вежливый персонал, всегда помогут с поиском товара, свежие фрукты-овощи, но тесноват.;5;30 октября 2020Площадь Ленина, 8;Искал свечи для торта! Персонал быстро и четко помогли в поиске);5;30 октября 2020Площадь Ленина, 8;Нашла, все что было нужно. Персонал адекватный, вежливый. Из минусов - тесновато, небольшое помещение, из плюсов - работают с 07 до 23:45;5;29 октября 2020Площадь Ленина, 8;"Ужасный магазин с соответствующим обслуживанием, планировка "" всё для людей"", в ""хвосте"" магазина кассы одна на одной, людям с тележками нормально не подойти, толкаясь проходить, кассиры в возрасте как мухи осенние, кассы еле грузятся, в самом магазине товар навален, склад а не магазин, боишься что на тебя свалится, бардак и просрочка с подгнившими овощами. Просто капремонт, нормальный зал с подходом к кассам свободным, молодой и расторопный персонал нанять, а то зрелище, заходить не хочется даже за чем-то одним нужным. Отвратительный магазин.";1;5 октября 2020Площадь Ленина, 8;Сотрудники не доброжелатнльные. Постоянные очереди. Грязно. Но есть хорошая продукция;3;10 июля 2020, отредактированПлощадь Ленина, 8;Тоже не нравится данный магазин, но он ближайший удобный к вокзалую, часто не дружелюбные кассиры, игнорируют вежливость покупателя.;1;16 декабря 2019, отредактированПлощадь Ленина, 8;Самая ужасная 5орочка в мире. Кассиры хамят. Работать не хотят. Рабочий персонал работает ОТВРАТИТЕЛЬНО.;1;20 июня 2019Площадь Ленина, 8;Самый ужасный магазин Пятёрочка в городе из-за своей конфигурации. Очень неудобное помещение, длинное и узкое. Народу всегда очень много, особенно вечерами, так что очереди в кассу длиннющие.Персонал доброжелательный, само помещение чистое, выкладка товара аккуратна. Сроки годности продуктов все соблюдены. Небольшой минус в том, что очень часто неразбериха с ценниками, разбросаны по всей поверхности, куда их крепят. Товар перед глазами, а ценник может быть в нескольких метрах от него.В целом магазин хороший. Тем более, что альтернатив поблизости нет.;4;11 сентября 2016Площадь Ленина, 8;Купил сегодня у них куриные бедрышки в лоточке, замотанные в полиэтилен. Когда дома развернул, окаалось, пованивают. Упаковано 7 августа, срок хранения 7 суток - еще не вышел. Значит, температуру не соблюдают.;1;11 августа 2016Площадь Ленина, 8;Самый адовый супермаркет из всех, в которых мне приходилось бывать. Во-первых, помещение неподходящее – узкое и вытянутое, места для прохода очень мало, вечно не протолкнуться. Про неразбериху в ценниках я даже говорить не буду. Ассортимент скудноват, но, может, оно и к лучшему, так как долго находиться в этом магазине и выбирать что-то сложно, толкучка не располагает.Но самый большой абзац – это постоянные длиннющие очереди на кассах, которые занимают и без того узкие проходы. Можно и полчаса простоять в очереди, а то еще и кассир уйдет на обед. Многие просто не выдерживают и кидают полные корзины с товаром около касс. К сожалению, это единственный супермаркет в округе, но я стараюсь лишний раз его не посещать. Кто-нибудь, пожалуйста, составьте им конкуренцию, откройте еще супермаркет поблизости! Из плюсов – работает круглосуточно.;1;5 августа 2016, отредактированПлощадь Ленина, 8;Еще с Челябинска помню, что Пятерочка - это ад. Грязь, вонь и низкие цены.В Петербурге сначала не узнала логотип, да и сами магазины.Сегодня зашла по пути сюда за сладким к чаю домой. Удивлена. Все чистенько, аккуратно разложено, выбор продуктов нормальный, а цены и правда очень приятные. Самое главное, что продукты в наличии и их достаточно. Ради любопытства поглядела сроки годности продуктов (молочка, консервированные продукты, бакалея, торты, колбасные изделия) все в норме.Очень я удивлена. За ежедневными покупками можно сюдаходить. Та же Макфа стоит 27 рублей пачка. В общем очень годно.;4;21 декабря 2014Курская, 28;Свежие фрукты и овощи, чистый и приятный магазин, быстрое обслуживание, вежливый персонал, нет очередей, располагается рядом с домом, хороший выбор товаров, хорошие цены.;5;14 декабря 2022, отредактированКурская, 28;Хороший выбор товаров, хорошие цены, располагается рядом с домом, вежливый персонал, быстрое обслуживание, свежие фрукты и овощи, чистый и приятный магазин, нет очередей, располагается рядом с домом.;5;5 декабря 2022, отредактированКурская, 28;Не могут при очереди из 6 и более открыть вторую кассу;1;19 октября 2022Курская, 28;Всё хорошо;5;24 мая 2022Курская, 28;Нормальный магазин, внутри чистенько, вроде бы следят, чтобы просрочки не было на полках, работает 3-4 кассы, очереди очень редко;4;7 мая 2022Курская, 28;Магазин норм, но ощущение, что тряпку для мытья пола не меняли НИКОГДА. Полы воняют так, что даже маска не спасает!!Апдейт: больше в магазине не пахнет, теперь все хорошо!;5;9 марта 2022, отредактированКурская, 28;Отлтчнай магазин, отличный персонал.;5;9 марта 2022Курская, 28;Проехал сотни городов россии и первый раз встретил такой ОХУЕ…ий персоналСпросил сигарет в грубой форме рявкнули что иди на другую кассу я бегать не собираюсь и это в культурной столицеУволить и гнать таких торгашейСамый помойный филиал;1;27 июля 2021Курская, 28;22.02.21 около 11.00 нахамили на кассе. Нахамила женщина кассир с короткой стрижкой и обесцвеченными волосами. При чём уже не первый раз. Хожу сюда часто, тк работа рядом. Пишу, потому что нет сил уже терпеть. Портит настроение своим хамским поведением без обосновательной на то причины.Самый замечательный кассир в этом магазине девушка в очках со светлыми длинными волосами, очень добрая и вежливая, от всех остальных работников данного магазина отличается своим культурным поведением.Научите пожалуйста других кассиров так же вежливо разговаривать с покупателями.;1;22 февраля 2021, отредактированКурская, 28;Постоянно недостаточно касс!;2;9 февраля 2019Курская, 28;Это самый ужасный магазин из всей сети. Персонал хамит друг другу, персонал хамит покупателям. Постоянно работает одна (максимум две) кассы, из-за этого всегда очереди. Магазин грязный. на прилавках просрочка бывает часто. никакого порядка в ценниках.;1;30 августа 2018Курская, 28;Люблю сеть магазинов, в целом!!! Только грязно постоянно, это отпугивает. И карта дурацкая бонусная. Прировняли бы один балл к рублю. А то ходишь в магазин целый месяц, а в конце понимаешь что насобирал всего на скидку в 59 рэ;5;14 июня 2018Черняховского, 16/5;Ого-го, обыкновенный продуктовый нужный магазин!;3;1 февраля 2023, отредактирован