Address;Text;Stars;DateЗагородный проспект, 35;"16.09.20 в 12.15 в магазине ""Пятёрочка"" Загородный проспект, 35, Санкт- Петербург. Опять стандартный (для магазинов этой сети) обман с ценником. Сайра ""Доброфлот"" на ценнике 95, в чек пробили 132 рубля. Им даже лень оправдываться (типа - не успели, забыли), как раньше. Проверяйте чеки, будьте внимательны! Здесь обманывают.";2;16 сентября 2020Загородный проспект, 35;Поменяйте, пожалуйста, режим работы на всех платформах. Я сюда дошла, а магазин с 9 работает.;4;11 мая 2020Загородный проспект, 35;Сотрудники на кассе особо работать не хотят.Как-то раз сотрудники не знали есть ли у них нужный мне товар или нет. Персонал сохраняет целостность и количество своих товаров и оборудования всеми силами.;1;10 июня 2019Загородный проспект, 35;Сотрудников в зале нет от слова вообще. Сроки годности нарушены. Пряники вообще с плесенью!;3;27 мая 2019Загородный проспект, 35;цены не дорогие, но нужно быть внимательным ценники не соответствуют продукции на полках, так же забывают убирать ценники на продукты акции которых закончились, так что нужно сверять чек...;0;8 августа 2018Невский проспект, 146;Нет свежей выпечки;3;30 июля 2023, отредактированНевский проспект, 146;Продавец неадекватный;1;24 июля 2023, отредактированНевский проспект, 146;Маловато месте. Стандартная пятерка;5;11 июля 2023, отредактированНевский проспект, 146;Не очень удобный магазин, чтобы найти что-то ходили кругами;3;11 июля 2023, отредактированНевский проспект, 146;Замечательный магазин. Всё чисто, цены соответствуют реальным. Очень хорошее обслуживание. Всегда приятно туда заходить.Моя пожилая мама теперь ходит только в этот магазин именно из за душевного обслуживания.Она попросила меня написать отзыв о магазине и прекрасной работе продавцов: Малике Кориговой, Сергея Санникова и Равиле Валиулине.Эти продавцы всегда доброжелательны, улыбчивы, всегда помогают, если их попросить. И часто сами предлагают помощь покупателям, если возникают какие либо затруднения.Спасибо вам огромное. За хорошую работу. За то, что моя старенькая мама всегда радостной приходит из вашего магазина.Очень здорово, что рядом есть магазин с таким высоким уровнем сервиса и доступными ценами!;5;23 апреля 2023Невский проспект, 146;Составлять отзывы на сетевые магазины - дело муторное и, по своей сути, никчёмное, но в данном случае можно сделать исключение. Сам магазин довольно просторный (привет, Дикси и КБ!), качество продукции на высоте, равно как и адекватность цен. Но в конкретно описываемый визит хотелось бы поблагодарить кассиров, приветливость и внимательность которых делает честь данному магазину.;0;17 апреля 2023Невский проспект, 146;Рядом, быстрое обслуживание, кассы для самостоятельной оплаты зачёт 👍;5;10 февраля 2023, отредактированНевский проспект, 146;Такое ощущение, что в магазине работает всего 2 человека.;5;26 января 2023Невский проспект, 146;Хорошие акции;1;6 января 2023Невский проспект, 146;Чисто. Но без суеты;5;3 декабря 2022, отредактированНевский проспект, 146;Нормальный магазин. Уважают тут покупателей. Готовы решить любые вопросы. Здороваются. Вежливо общаются. Богатый ассортимент различной продукции от съедобной до несъедобной. Есть свое собственное кулинарное производство. Все удобно расположено. Нет узких проходов. Нет духоты. Качество товаров приличное. За чистотой стараются следить. Много заманчивых временных акций. Интересная программа лояльности. Средний уровень цен. Что-то можно купить и по низким ценам.;4;29 ноября 2022Невский проспект, 146;Недорого и это главное.;4;11 ноября 2022Невский проспект, 146;Акции это главный плюс Пятерочки. Товары неплохие по качеству. Персонал так себе.;4;23 сентября 2022Невский проспект, 146;К кассе самообслуживания после двух вызовов, сотрудник так и не подошёл.;4;9 сентября 2022Невский проспект, 146;Там работает на кассе, злобный парень гном. Постоянно употребляет на рабочем месте энергетик. Видимо после бурных ночных возлияний. А все посетитили, его враги...которые мешают ему отдыхать на работе и востонавливать хп, для новых ратных подвигов.;1;28 августа 2022Невский проспект, 146;1 холодильник с холодными б/а напитками и все.;2;17 апреля 2022Невский проспект, 146;Хороший магазин. Очень жаль, что убрали свою выпечку, было удобно брать свежий хлебушек и пирожки.;3;24 марта 2022Невский проспект, 146;работники - мошенники и обманщики;5;14 февраля 2022Невский проспект, 146;Несмотря на недочёты в общем и целом магазин неплохой, всегда хожу возле дома у себя и спокойно покупаю продукты.;1;13 февраля 2022Невский проспект, 146;много лет хожу в этот магазин. да хотелось бы конечно чтобы было почище и продукты лежали красивее, но еда от этого не становится менее вкусной;4;19 января 2022Невский проспект, 146;Пробили покупку. Я уточнила, почему так дорого, кассир сказала «Вы столько набрали! Если нет денег, чего тогда приходите».Дома обнаружила, что мне пробили один товар по три раза. Кассир Гаврилова Ольга Викторовна, Невский 146 лит А. 27.12.21;4;27 декабря 2021Невский проспект, 146;ну пятерочка как обычно, товары по залу, ценники не везде совпадают, товар есть, но систематизации в магазине нет, на кассах очереди;1;15 декабря 2021Невский проспект, 146;Нет бравлов , день испорчен;3;1 октября 2021Невский проспект, 146;Приятный, чистый магазин, в отличие от московских. Хороший ассортимент;1;27 августа 2021Невский проспект, 146;"Чистый, приятный магазин в сравнении с Дикси. Хороший ассортимент, акции. Но всю картину портят отвратительные, грубые кассиры. Сегодня обслуживала девушка, похожая на азиатку, ни ""здравствуйте"", ни "" до свидания "", грубо гавкнула, чтобы я выгрузила ей товары с корзины на ленту, покидала мне товары, не спросив выручайку. Когда я ей сказала какая она "" приветливая"", демонстративно отвернулась. Обычно негативные отзывы я оставляю редко, но тут очень неприятно. Кажется, этой даме ни её работа, ни покупатели жутко не по душе.";5;17 августа 2021Невский проспект, 146;Отличная пятёрочка, в сравнении с тем как они обычно выглядят. Чисто, приятный ремонт, вкусная выпечка, кассы самообслуживания работают и очень удобные. Все бы пятёрочки так выглядели;3;5 мая 2021Невский проспект, 146;Нормальный недорогой кофе, свежевыжатый сок какой-то водянистый, нормальная выпечка;5;23 апреля 2021Невский проспект, 146;Плитка магазина – тонкая отсылка к великому сериалу Твин Пикс. Хожу в магазин исключительно из-за эстетических переживаний;4;23 апреля 2021Невский проспект, 146;Хорошая Пятёрочка, зашла посмотреть время работы и аж обидно стало за такой низкий рейтинг! Выпечка норм, после 20 ещё и скидки💔 нет отдела бытовой химии, но магазин рассчитан скорее на мини кафе и перекус. Большой отдел молочной продукции, снэков. Свежий, чистый ремонт. (Если вас обидели кассиры, могу рекомендовать кассы самообслуживания, они тут тоже есть!));5;17 апреля 2021Невский проспект, 146;Пятерочку пятерочке, не знаю, почему все ставят единицы этому магазину. Возможно чего-то я не знаю, не важно. 15.04.21 в 17:30 там все было замечательно, чисто, убрано, ценники все соответствующие, кассир, попятная женщина в возрасте. В общем лайк однозначно.;5;15 апреля 2021Невский проспект, 146;Типичный эконом магазин. Частенько ценники на один товар подкладывают под другой, можно напороться на просрочку и обычная история с очередями в кассу. Так что надо быть более чем внимательным. Однако тут почище и попросторнее чем в Диксях.Меняю отзыв, т.к. сказал продавцу, что ценник отсутствует, прошло 2 дня, но ничего не поменялось;5;26 марта 2021, отредактированНевский проспект, 146;Очень странный магазин.1) Как только заходишь, сразу видишь пол, который ничего кроме отвращения (а у эпилептиков и того хуже) не вызывает2) Зачем-то товары одной категории по разным залам разнесли (например, сладости). Наверное, чтобы ещё сильнее вбить покупателям мысль, что сюда лучше не приходить3) Ценники на какие-то товары перепутаны4) Кассы самообслуживания бесполезны, когда хочешь отсканировать штрих-код из мобильного приложения. Посмотрите, как ребята из магазина через дорогу свои кассы организовали5) Сотрудники магазина любят покурить и подымить на посетителей и просто прохожих;1;22 февраля 2021Марата, 65;хороший не дорогой магазин, все отлично;5;29 мая 2023Марата, 65;Пятёрка конечно огонь;1;3 марта 2023, отредактированМарата, 65;Был в магазине в пятницу 27 мая 2022г. перед закрытием, после совершения покупки, директор магазина вёл себя по хамски по отношению ко мне, не дал мне упоковать в рюкзак покупку, грубо сказв что упакуешь на улице он стал выталкивать меня из магазина, вместо того чтобы вежливо попросить поторопиться. У меня остался осадок от такого отношения к покупателю;2;28 мая 2022Марата, 65;Магазин не соответствует нормам потребителя, на большинстве товаров нет ценников. А если и есть то неправильные, цены стоят старые, а продают по другой стоимости;1;17 апреля 2022Марата, 65;Ценники вечно перепутанные! Каждый раз проверяйте чек!Сегодня произошла не очень лицеприятная ситуация: сотрудник магазина публично наказывала воришку. Слышать ее оры на весь магазин, нецензурную отборную брань было крайне не приятно покупателям! Фу, позорище!!!;1;20 декабря 2021Марата, 65;Тухлым мяском полакомился. Спасибо пятёрочка.;1;30 ноября 2021Марата, 65;Нет ценников либо не правильныеСтараюсь не покупать там,по возможности;4;3 мая 2021Марата, 65;Обычная Пятёрочка. Рядом парковка велосипедов на прокат.;5;28 апреля 2021Марата, 65;Абсолютно обычная пятёрочка, проблем при посещении не было.;1;7 октября 2020Марата, 65;Отвратный магаз,лучше не тратить свои нервы и время,и сходить в реал в ста метрах;1;12 сентября 2020Марата, 65;Цены не соответствуют ценникам, покупал квас, пробили как шоколадку. 3 раза посещал это место, и все 3 раза обманывали!;1;1 мая 2020Марата, 65;Продавцы на вопрос об отсутствие ценников на товаре, отвечают по хамски. Что будут завтра и ищите сканер.;5;12 ноября 2019Марата, 65;Мне нравится эта Пятёрочка тем, что в ней пока ещё не очень большая проходимость и поэтому можно найти такие позиции на полках, которые в других филиалах сметают в первый же день )));2;23 сентября 2019Марата, 65;Очереди каждый раз, заходил 8 раз, и всегда работает одна касса.;5;10 августа 2019Марата, 65;"Лет 10 на этом месте работал супермаркет ""полушка"" и это был ад, но его закрыли и открыли пятёрочку, всё чисто и красиво, будем заходить переодически";0;29 июля 2019Суворовский проспект, 10;Хороший магазин у дома. Персонал вежливый.;5;13 июня 2023Суворовский проспект, 10;Оивйиоевитеаи;1;22 апреля 2023Суворовский проспект, 10;Обычный магазин. Уважают тут покупателей. Готовы решить любые вопросы. Здороваются. Вежливо общаются. Богатый ассортимент различной продукции. Не все удобно расположено. Нет духоты. Возле кассовой зоны всегда хаос. Качество товаров приличное. За чистотой стараются следить. Много заманчивых временных акций. Интересная программа лояльности. Средний уровень цен. Что-то можно купить по низким ценам.;3;26 апреля 2022Суворовский проспект, 10;Просто шарага а не магазин! Женщина на кассе ,в платке на голове, жутко хамит и выражается так как не должен выражаться человек работающий в сфере обслуживания! Ценники не соответствуют стоящим товарам за ними! Очереди вечные 5+ человек стабильно!Увидев оценку я понял что мой комментарий не особо повлияет, но надеюсь что какой-либо тренинг по стрессоустойчивости и культуре общения организуют для сотрудников данного магазина! В особенности он требуется женщине в платке!;1;28 января 2022Суворовский проспект, 10;Пятёрочка как Пятёрочка. Минус один, очередь постоянная вечером в 7-10+ человек. Работает одна касса.;1;14 октября 2021Суворовский проспект, 10;Бухой охранник докопался до меня якобы я что-то украл, когда он предложил показать мне момент кражи на камере, по какой то непонятной причине, сделать он этого не смог. Бардак полный, чел тупа на рабочем месте хуч потягивает, советую обходить этот магазин стороной.;1;25 сентября 2021Суворовский проспект, 10;Дёшево и сердито, но персонала не хватает. Довольно грязно, часто отсутствуют ценники или путаница с ними, в целом атмосфера «очень-очень эконом» магазина. Хоть это и Пятёрочка, но есть филиалы поприличнее :);3;11 июля 2021Суворовский проспект, 10;я пришла за 15 минут до закрытия магазина, работала 1 касса (из 3), очередь была из 4-5 человек. за 10 минут до закрытия очень усталого вида девушка встала возле двери и весьма агрессивным образом стала предупреждать заходящих (их было от силы 3 человека), что она в 10 закроет дверь. когда один из покупателей предложил вполне разумную идею открыть вторую кассу, она прямым текстом предложила ему пойти домой. я понимаю, что работа стрессовая, особенно когда сотрудников не хватает, но и грубить людям наверно тоже не надо. то, что на мое «здравствуйте» от кассира я не услышала ничего, даже рядом не стоит.;1;2 июня 2021Суворовский проспект, 10;Большая очередь, а касса только одна работает;1;27 марта 2021Суворовский проспект, 10;Когда уже наведут порядок с ценниками, их либо нет, либо всё в кучу(особенно на холодильниках!)!!;1;20 марта 2021Суворовский проспект, 10;Очереди, путаница с ценниками, классическая пятерочка.;3;26 февраля 2021Суворовский проспект, 10;"Грязно, тесно, ценники часто не соответствуют(и всегда не в пользу покупателя), а главное постоянные очереди на кассе! На просьбу открыть вторую кассу ответ один: ""Кассиров нет!""";1;15 февраля 2021Суворовский проспект, 10;Ужасный магазин, надеюсь его закроют;1;24 января 2021Суворовский проспект, 10;Купили 4 банки пива по 49 рублей за 224 рубля);1;2 декабря 2020Суворовский проспект, 10;Сказали заткнуть рот тряпкой. Нос можно не закрывать. Рот достаточно. Вся суть происходящего в одной фразе. Это не прихоть продавца. То что есть мед заключение запрещающее одевать тряпку на лицо продавцов не волнует;1;12 октября 2020Суворовский проспект, 10;Была всего один раз, сегодня. Не магазин, а лабиринт с узкими проходами. В остальном нет претензий, очереди не было, кассир вежливая, просрочка не попалась, ценники соответствовали. Чудеса :);4;24 сентября 2020Суворовский проспект, 10;Отвратительно хамский персонал который не знает законов по которым продает. Какой, простите, паспорт при энергетиках? Захотели проблемы?Будут, ребят. Ждите проверку.;1;30 августа 2020Суворовский проспект, 10;В принципе проблем не возникало,но...почти год хожу туда с выручай картой(она в телефоне, в спец.приложении,т.е только для начисления бонусов)Так вот копила я бонусы,копила,вернее так думала, пока не приехали в деревню под Питером,там даю свой телефон,мне продавец: Девушка,а ваша карта не активирована...Ни одна кассирша в нашей 5 даже не пискнула об этом;1;19 июня 2020